{"as_of":"2026-10-27T01:05:59-0400","counts_24h":{"empty_inferred":2,"empty_measured":1,"finished":2,"launched":1,"nonempty":1,"precheck_skip":1},"exporter":"wb-export/1","inferred_empty":[{"inferred":true,"job":"RQ-D","lane":"claude","ts":"2026-10-27T01:05:59-0400"}],"lanes":[{"ceiling":24,"floor":1,"held":true,"held_until":"2026-11-02T12:25:00-0500","hold_kind":"auto","hold_pattern":"codex_usage_limit","lane":"codex-cmp","queue_depth":1,"running":null,"state":"held","target":4},{"ceiling":24,"floor":1,"held":null,"held_until":null,"hold_kind":null,"hold_pattern":null,"lane":"codex-personal","queue_depth":1,"running":3,"state":"running","target":4},{"ceiling":24,"floor":1,"held":null,"held_until":null,"hold_kind":null,"hold_pattern":null,"lane":"claude","queue_depth":0,"running":0,"state":"idle","target":4},{"ceiling":24,"floor":1,"held":true,"held_until":null,"hold_kind":"manual","hold_pattern":"manual","lane":"devin","queue_depth":1,"running":null,"state":"held","target":4},{"ceiling":24,"floor":1,"held":null,"held_until":null,"hold_kind":null,"hold_pattern":null,"lane":"claude-api","queue_depth":0,"running":null,"state":"unknown","target":4}],"paused":false,"queue":{"by_lane":{"claude":0,"claude-api":0,"codex-cmp":1,"codex-personal":1,"devin":1},"by_tier":{"fast":0,"frontier":1,"mid":0,"work":1},"ready_total":3},"schema":"workbench.snapshot.v1","seq":1793077559,"sources":{"jobs":"ok","ready":"ok","slots":"ok","status":"ok"}}
